{
  "$schema": "https://json-schema.org/draft/2020-12/schema",
  "$id": "https://github.com/SuperInstance/midden/blob/room-protocol/protocol/room-state.schema.json",
  "title": "room-protocol/1 — a visitable room's settled state",
  "description": "The seam that lets an outside system (PLATO, the-tap, a walker) VISIT a room built from real fleet ledgers. A room is a settled triangle: three ledger surfaces (values, walks, canon) meeting at one integer floor, read by named instruments, strained by one live wire. Every number in a room state must trace to a fixture or be declared derived/stand-in. Enforced by protocol/validate.mjs (zero-dep subset validator).",
  "type": "object",
  "required": ["protocol", "room", "instruments", "surfaces", "strain", "visitors", "provenance"],
  "additionalProperties": false,
  "properties": {
    "protocol": { "const": "room-protocol/1" },
    "room": {
      "type": "object",
      "required": ["id", "title", "kind", "generatedAt", "builder", "fixtures"],
      "additionalProperties": false,
      "properties": {
        "id": { "type": "string", "minLength": 1 },
        "title": { "type": "string", "minLength": 1 },
        "kind": { "const": "settled-triangle" },
        "generatedAt": {
          "type": "string",
          "pattern": "^\\d{4}-\\d{2}-\\d{2}T\\d{2}:\\d{2}:\\d{2}(\\.\\d+)?(Z|[+-]\\d{2}:?\\d{2})$"
        },
        "builder": {
          "type": "object",
          "required": ["script", "command"],
          "additionalProperties": false,
          "properties": {
            "script": { "const": "protocol/build-room-state.mjs" },
            "command": { "const": "node protocol/build-room-state.mjs --stamp <ISO-8601>" }
          }
        },
        "fixtures": {
          "type": "object",
          "required": ["hashAlgorithm", "files"],
          "additionalProperties": false,
          "properties": {
            "hashAlgorithm": { "const": "sha256" },
            "files": {
              "type": "array",
              "minItems": 5,
              "maxItems": 6,
              "items": {
                "type": "object",
                "required": ["path", "sha256", "bytes"],
                "additionalProperties": false,
                "properties": {
                  "path": { "type": "string", "pattern": "^data/[a-z-]+\\.json$" },
                  "sha256": { "type": "string", "pattern": "^[0-9a-f]{64}$" },
                  "bytes": { "type": "number", "integer": true, "minimum": 1 }
                }
              }
            }
          }
        }
      }
    },
    "instruments": {
      "type": "array",
      "minItems": 2,
      "items": {
        "type": "object",
        "required": ["id", "label", "order", "measures", "units", "source"],
        "additionalProperties": false,
        "properties": {
          "id": { "type": "string", "minLength": 1 },
          "label": { "type": "string", "minLength": 1 },
          "order": { "type": "number", "integer": true, "minimum": 0 },
          "measures": { "type": "string", "minLength": 1 },
          "units": { "type": "string", "minLength": 1 },
          "source": {
            "type": "object",
            "required": ["repo", "ref"],
            "additionalProperties": false,
            "properties": {
              "repo": { "type": "string", "minLength": 1 },
              "ref": { "type": "string", "minLength": 1 },
              "license": { "type": "string", "minLength": 1 },
              "vendoredAt": { "type": "string", "minLength": 1 },
              "note": { "type": "string", "minLength": 1 }
            }
          }
        }
      }
    },
    "surfaces": {
      "type": "object",
      "required": ["ledger", "lineage", "canon"],
      "additionalProperties": false,
      "properties": {
        "ledger": {
          "type": "object",
          "required": ["source", "provenance", "turns", "ridges", "floor"],
          "additionalProperties": false,
          "properties": {
            "source": { "const": "extractValuesLedger" },
            "provenance": { "type": "string", "minLength": 1 },
            "turns": { "type": "number", "integer": true, "minimum": 1 },
            "dormantCount": { "type": "number", "integer": true, "minimum": 0 },
            "ridges": {
              "type": "array",
              "minItems": 1,
              "items": {
                "type": "object",
                "required": ["id", "value", "strength", "evidenceCount", "evidence"],
                "additionalProperties": false,
                "properties": {
                  "id": { "type": "string", "minLength": 1 },
                  "value": { "type": "string", "minLength": 1 },
                  "strength": { "type": "number", "minimum": 0, "maximum": 1 },
                  "evidenceCount": { "type": "number", "integer": true, "minimum": 1 },
                  "firstSeenTurn": { "type": "number", "integer": true, "minimum": 0 },
                  "lastSeenTurn": { "type": "number", "integer": true, "minimum": 0 },
                  "evidence": {
                    "type": "array",
                    "minItems": 1,
                    "items": {
                      "type": "object",
                      "required": ["ref", "quote"],
                      "additionalProperties": false,
                      "properties": {
                        "ref": { "type": "string", "minLength": 1 },
                        "quote": { "type": "string", "minLength": 1 },
                        "source": { "type": "string", "minLength": 1 }
                      }
                    }
                  }
                }
              }
            },
            "floor": {
              "type": "object",
              "required": ["kind", "axes", "rule"],
              "additionalProperties": false,
              "properties": {
                "kind": { "const": "integer-lattice" },
                "axes": { "type": "array", "minItems": 2, "maxItems": 2, "items": { "type": "string", "minLength": 1 } },
                "rule": { "type": "string", "minLength": 1 }
              }
            }
          }
        },
        "lineage": {
          "type": "object",
          "required": ["source", "walk", "verdict", "gestureReadouts"],
          "additionalProperties": false,
          "properties": {
            "source": { "const": "breed()/chain()" },
            "walk": {
              "type": "object",
              "required": ["seed", "dimensions", "rounds", "points"],
              "additionalProperties": false,
              "properties": {
                "seed": { "type": "string", "minLength": 1 },
                "artist": { "type": "string", "minLength": 1 },
                "persona": { "type": "string", "minLength": 1 },
                "dimensions": { "type": "number", "integer": true, "minimum": 2 },
                "rounds": { "type": "number", "integer": true, "minimum": 2 },
                "points": {
                  "type": "array",
                  "minItems": 2,
                  "items": {
                    "type": "array",
                    "minItems": 2,
                    "items": { "type": "number", "integer": true }
                  }
                },
                "ancestry": {
                  "type": "array",
                  "minItems": 1,
                  "items": {
                    "type": "object",
                    "required": ["from", "to"],
                    "additionalProperties": false,
                    "properties": {
                      "from": { "type": "number", "integer": true, "minimum": 0 },
                      "to": { "type": "number", "integer": true, "minimum": 0 },
                      "driftQ": { "type": "number" },
                      "sigmaDrop": { "type": "number" }
                    }
                  }
                }
              }
            },
            "verdict": {
              "type": "object",
              "required": ["status", "round"],
              "additionalProperties": false,
              "properties": {
                "status": { "type": "string", "minLength": 1 },
                "round": { "type": "number", "integer": true, "minimum": 0 },
                "sigma": { "type": "number", "minimum": 0 },
                "residueDims": { "type": "number", "integer": true, "minimum": 0 }
              }
            },
            "gestureReadouts": {
              "type": "object",
              "required": ["instrument", "mode", "rounds", "gap"],
              "additionalProperties": false,
              "properties": {
                "instrument": { "const": "torsion" },
                "mode": { "const": "cumulative" },
                "rounds": {
                  "type": "array",
                  "minItems": 2,
                  "items": {
                    "type": "object",
                    "required": ["round", "arcLength", "bendingEnergy", "torsion", "planarity"],
                    "additionalProperties": false,
                    "properties": {
                      "round": { "type": "number", "integer": true, "minimum": 0 },
                      "arcLength": { "type": "number", "minimum": 0 },
                      "bendingEnergy": { "type": "number", "minimum": 0 },
                      "torsion": { "type": "number", "minimum": 0 },
                      "planarity": { "type": "number", "minimum": 0, "maximum": 1 },
                      "sigma": { "type": "number" }
                    }
                  }
                },
                "gap": {
                  "type": "object",
                  "required": ["round", "corroborated", "planarityAtGap"],
                  "additionalProperties": false,
                  "properties": {
                    "round": { "type": "number", "integer": true, "minimum": 0 },
                    "corroborated": { "type": "boolean" },
                    "planarityAtGap": { "type": "number", "minimum": 0, "maximum": 1 },
                    "mechanism": { "type": "string", "minLength": 1 },
                    "torsionAddedAtGap": { "type": "number", "minimum": 0 },
                    "priorPerVertexMean": { "type": "number", "minimum": 0 }
                  }
                }
              }
            }
          }
        },
        "canon": {
          "type": "object",
          "required": ["hash", "replaySteps", "stars", "choir", "drown"],
          "additionalProperties": false,
          "properties": {
            "hash": { "type": "string", "pattern": "^0x[0-9a-f]{16}$" },
            "replaySteps": { "type": "number", "integer": true, "minimum": 1 },
            "stars": {
              "type": "array",
              "minItems": 1,
              "items": {
                "type": "object",
                "required": ["index", "digit"],
                "additionalProperties": false,
                "properties": {
                  "index": { "type": "number", "integer": true, "minimum": 0 },
                  "digit": { "type": "string", "minLength": 1 },
                  "value": { "type": "number", "integer": true, "minimum": 0 }
                }
              }
            },
            "choir": {
              "type": "object",
              "required": ["teeth", "unplayableStrata"],
              "additionalProperties": false,
              "properties": {
                "teeth": {
                  "type": "array",
                  "minItems": 1,
                  "items": {
                    "type": "object",
                    "required": ["index", "n", "degrees"],
                    "additionalProperties": false,
                    "properties": {
                      "index": { "type": "number", "integer": true, "minimum": 0 },
                      "n": { "type": "number", "integer": true, "minimum": 1 },
                      "degrees": { "type": "number" }
                    }
                  }
                },
                "unplayableStrata": { "type": "number", "integer": true, "minimum": 0 },
                "unplayableBasis": { "type": "string", "minLength": 1 }
              }
            },
            "drown": {
              "type": "object",
              "required": ["whirlpools"],
              "additionalProperties": false,
              "properties": {
                "note": { "type": "string", "minLength": 1 },
                "whirlpools": {
                  "type": "array",
                  "minItems": 1,
                  "items": {
                    "type": "object",
                    "required": ["id", "edge", "issueUrl", "state"],
                    "additionalProperties": false,
                    "properties": {
                      "id": { "type": "string", "minLength": 1 },
                      "edge": {
                        "type": "object",
                        "required": ["from", "to"],
                        "additionalProperties": false,
                        "properties": {
                          "from": { "type": "string", "minLength": 1 },
                          "to": { "type": "string", "minLength": 1 }
                        }
                      },
                      "issueUrl": { "type": "string", "pattern": "^https://github\\.com/" },
                      "state": { "type": "string", "minLength": 1 },
                      "kind": { "type": "string", "minLength": 1 }
                    }
                  }
                }
              }
            }
          }
        }
      }
    },
    "strain": {
      "type": "object",
      "required": ["candorLine"],
      "additionalProperties": false,
      "properties": {
        "candorLine": {
          "type": "object",
          "required": ["instrument", "sourceRoom", "windowDays", "status", "pulses"],
          "additionalProperties": false,
          "properties": {
            "instrument": { "const": "twist-shear" },
            "sourceRoom": { "type": "string", "minLength": 1 },
            "windowDays": { "type": "number", "integer": true, "minimum": 1 },
            "status": { "enum": ["measured", "stand-in"] },
            "note": { "type": "string", "minLength": 1 },
            "derivedFrom": { "type": "string", "minLength": 1 },
            "pulses": { "type": "array", "minItems": 2, "items": { "type": "number", "minimum": 0 } }
          }
        }
      }
    },
    "visitors": {
      "type": "object",
      "required": ["may", "writes"],
      "additionalProperties": false,
      "properties": {
        "may": {
          "type": "array",
          "minItems": 1,
          "items": { "type": "string", "enum": ["observe", "quote-with-citation", "mark"] }
        },
        "writes": {
          "type": "object",
          "required": ["free", "markCost"],
          "additionalProperties": false,
          "properties": {
            "free": { "const": false },
            "markCost": { "const": "fuel" },
            "rule": { "type": "string", "minLength": 1 }
          }
        }
      }
    },
    "provenance": {
      "type": "object",
      "required": ["sources", "gaps"],
      "additionalProperties": false,
      "properties": {
        "sources": {
          "type": "array",
          "minItems": 1,
          "items": {
            "type": "object",
            "required": ["fixture", "repo", "ref"],
            "additionalProperties": false,
            "properties": {
              "fixture": { "type": "string", "pattern": "^data/[a-z-]+\\.json$" },
              "repo": { "type": "string", "minLength": 1 },
              "ref": { "type": "string", "minLength": 1 },
              "note": { "type": "string", "minLength": 1 }
            }
          }
        },
        "gaps": {
          "type": "array",
          "minItems": 1,
          "items": {
            "type": "object",
            "required": ["area", "gap", "consequence"],
            "additionalProperties": false,
            "properties": {
              "area": { "type": "string", "minLength": 1 },
              "gap": { "type": "string", "minLength": 1 },
              "consequence": { "type": "string", "minLength": 1 }
            }
          }
        }
      }
    }
  }
}
