{
  "protocol": "room-protocol/1",
  "room": {
    "id": "midden",
    "title": "the midden at dusk",
    "kind": "settled-triangle",
    "generatedAt": "2026-09-20T17:30:00+08:00",
    "builder": {
      "script": "protocol/build-room-state.mjs",
      "command": "node protocol/build-room-state.mjs --stamp <ISO-8601>"
    },
    "fixtures": {
      "hashAlgorithm": "sha256",
      "files": [
        {
          "path": "data/terrain.json",
          "sha256": "e029cfbbf8b2d9b894f8104fb4fd331b21ec35bf1ead3c2b9b329f1bf312acd1",
          "bytes": 15000
        },
        {
          "path": "data/lineage.json",
          "sha256": "8272e397291619c075449750ea71cb5cd99b2657e42396afd7c64eb73c617b46",
          "bytes": 5326
        },
        {
          "path": "data/whirlpools.json",
          "sha256": "64e2b0b1df40a41b52ed50b258dd20dd8f0fbe3fbbbc8a0c4011f1c139235113",
          "bytes": 1655
        },
        {
          "path": "data/sky.json",
          "sha256": "3cae9b331c70da8e895a2d45c74afea20cc30c0bb6197eb9ab91ab66e5fd7583",
          "bytes": 463
        },
        {
          "path": "data/choir.json",
          "sha256": "a26b6f58a2e13f047fde02684f06882cdc62e0f3a95b7349ea40d6ca4ef9037f",
          "bytes": 876
        }
      ]
    }
  },
  "instruments": [
    {
      "id": "torsion",
      "label": "gesture-kit torsion (discrete Frenet)",
      "order": 3,
      "measures": "third-order turning of a walked path; the Understory readout, round by round",
      "units": "dimensionless (cumulative 1−cos turning; planarity 1 = flat)",
      "source": {
        "repo": "SuperInstance/gesture-kit",
        "ref": "8cd5aa415235b41e4aa944104dd796f163510b0c",
        "license": "MIT",
        "vendoredAt": "vendor/gesture-kit/gesture.js"
      }
    },
    {
      "id": "twist-shear",
      "label": "twist-engine σ-shear",
      "order": 2,
      "measures": "commensuration strain of a transcript under re-measurement — a room's candor line",
      "units": "seconds (σ = 0.24·s, grid = 0.6·s, honest regime 0.15°–6°)",
      "source": {
        "repo": "SuperInstance/twist-engine",
        "ref": "docs/1-physicist.md §I (instrument constants, verified in-tree)",
        "note": "named to mark the boundary: it produces NO numbers in this room state yet — the strain pulses below are a declared stand-in, not a σ-shear measurement"
      }
    }
  ],
  "surfaces": {
    "ledger": {
      "source": "extractValuesLedger",
      "provenance": "SuperInstance/the-tap @ lane-l-commune-deep 42f878e (workers/room-worker/src/values-ledger.ts)",
      "turns": 20,
      "dormantCount": 0,
      "ridges": [
        {
          "id": "returns:room:foghorns",
          "value": "keeps returning to foghorns",
          "strength": 1,
          "evidenceCount": 7,
          "firstSeenTurn": 3,
          "lastSeenTurn": 20,
          "evidence": [
            {
              "ref": "0",
              "quote": "the foghorns lied again last night",
              "source": "transcript"
            },
            {
              "ref": "1",
              "quote": "what did the foghorns say?",
              "source": "transcript"
            },
            {
              "ref": "2",
              "quote": "foghorns always lie when the glass drops",
              "source": "transcript"
            },
            {
              "ref": "8",
              "quote": "the foghorns again? you always come back to them",
              "source": "transcript"
            },
            {
              "ref": "12",
              "quote": "the foghorns know it first",
              "source": "transcript"
            },
            {
              "ref": "17",
              "quote": "foghorns, reef, silence — the usual litany",
              "source": "transcript"
            },
            {
              "ref": "19",
              "quote": "then we talk about the foghorns instead",
              "source": "transcript"
            }
          ]
        },
        {
          "id": "pour:wesley",
          "value": "pours before being asked",
          "strength": 0.8,
          "evidenceCount": 3,
          "firstSeenTurn": 7,
          "lastSeenTurn": 20,
          "evidence": [
            {
              "ref": "6",
              "quote": "*pours another glass without asking*",
              "source": "transcript"
            },
            {
              "ref": "9",
              "quote": "*refills the mug before being asked*",
              "source": "transcript"
            },
            {
              "ref": "14",
              "quote": "*sets down a glass for the quiet one*",
              "source": "transcript"
            }
          ]
        },
        {
          "id": "refusal:corvan:name",
          "value": "refuses to speak of name",
          "strength": 0.65,
          "evidenceCount": 2,
          "firstSeenTurn": 4,
          "lastSeenTurn": 20,
          "evidence": [
            {
              "ref": "3",
              "quote": "I won't name the drowned ship.",
              "source": "transcript"
            },
            {
              "ref": "5",
              "quote": "I won't name her, Mara.",
              "source": "transcript"
            }
          ]
        },
        {
          "id": "returns:room:glass",
          "value": "keeps returning to glass",
          "strength": 0.6000000000000001,
          "evidenceCount": 3,
          "firstSeenTurn": 15,
          "lastSeenTurn": 20,
          "evidence": [
            {
              "ref": "2",
              "quote": "foghorns always lie when the glass drops",
              "source": "transcript"
            },
            {
              "ref": "6",
              "quote": "*pours another glass without asking*",
              "source": "transcript"
            },
            {
              "ref": "14",
              "quote": "*sets down a glass for the quiet one*",
              "source": "transcript"
            }
          ]
        },
        {
          "id": "commitment:mara:keep",
          "value": "gave their word on keep",
          "strength": 0.5,
          "evidenceCount": 1,
          "firstSeenTurn": 8,
          "lastSeenTurn": 20,
          "evidence": [
            {
              "ref": "7",
              "quote": "I will keep the lantern lit tonight",
              "source": "transcript"
            }
          ]
        },
        {
          "id": "commitment:mara:promise",
          "value": "gave their word on promise",
          "strength": 0.5,
          "evidenceCount": 1,
          "firstSeenTurn": 11,
          "lastSeenTurn": 20,
          "evidence": [
            {
              "ref": "10",
              "quote": "I promise the light stays on",
              "source": "transcript"
            }
          ]
        },
        {
          "id": "commitment:corvan:check",
          "value": "gave their word on check",
          "strength": 0.5,
          "evidenceCount": 1,
          "firstSeenTurn": 14,
          "lastSeenTurn": 20,
          "evidence": [
            {
              "ref": "13",
              "quote": "I will check the moorings, my word on it",
              "source": "transcript"
            }
          ]
        },
        {
          "id": "refusal:corvan:say",
          "value": "refuses to speak of say",
          "strength": 0.5,
          "evidenceCount": 1,
          "firstSeenTurn": 17,
          "lastSeenTurn": 20,
          "evidence": [
            {
              "ref": "16",
              "quote": "can't say what I saw out there",
              "source": "transcript"
            }
          ]
        },
        {
          "id": "refusal:corvan:would",
          "value": "refuses to speak of would",
          "strength": 0.5,
          "evidenceCount": 1,
          "firstSeenTurn": 19,
          "lastSeenTurn": 20,
          "evidence": [
            {
              "ref": "18",
              "quote": "I would rather not talk about the ship",
              "source": "transcript"
            }
          ]
        }
      ],
      "floor": {
        "kind": "integer-lattice",
        "axes": [
          "k",
          "s"
        ],
        "rule": "identity is exact integers; floats never touch identity (quilt-studio floor law)"
      }
    },
    "lineage": {
      "source": "breed()/chain()",
      "walk": {
        "seed": "q16/midden-at-dusk",
        "artist": "duke",
        "persona": "purist",
        "dimensions": 16,
        "rounds": 8,
        "points": [
          [
            916667,
            15975,
            207173,
            14048,
            500000,
            794539,
            551519,
            820313,
            985625,
            167720,
            23413,
            1000000,
            485714,
            0,
            939225,
            900000
          ],
          [
            883333,
            31501,
            407639,
            75784,
            500000,
            934473,
            521814,
            820313,
            1000000,
            236451,
            126306,
            1000000,
            542857,
            0,
            900850,
            650000
          ],
          [
            775000,
            19048,
            410485,
            45939,
            500000,
            943125,
            490724,
            820313,
            1000000,
            198650,
            76565,
            1000000,
            542857,
            0,
            856122,
            650000
          ],
          [
            766667,
            37900,
            442994,
            81531,
            500000,
            931342,
            562629,
            820313,
            1000000,
            147205,
            135885,
            1000000,
            514286,
            0,
            825523,
            700000
          ],
          [
            733333,
            12500,
            468220,
            63170,